Title,Article,Category,PressCompany
AI 통번역·카메라 인기에 예판 신기록 세운 갤S24…대세는 '울트라'(종합),"갤럭시 S24 사전 판매량 121만대…""S 시리즈 역대 최대""울트라 선택률 60%, 티타늄 블랙·마블 그레이 색상 인기""AI 활용한 실시간 통화 통역, 사진 편집 등 新기능 역할 커""[서울=뉴시스] 고승민 기자 = 삼성전자와 SK텔레콤, KT, LG유플러스 등 이동통신3사는 26일 갤럭시 S24 사전 개통 시작과 함께 지난 19일부터 25일까지 진행한 사전 판매 결과를 발표했다. 사진은 삼성전자의 첫 AI 폰 '갤럭시 S24' 시리즈가 공개된 18일 서울 강남구 '삼성 강남'에 전시된 갤럭시 S24 시리즈. 2024.01.18. kkssmm99@newsis.com[서울=뉴시스]윤정민 심지혜 기자 = 삼성전자 첫 인공지능(AI)폰 갤럭시 S24 시리즈가 S 시리즈 사전 판매량을 경신했다. 전작(갤럭시 S23) 대비 12만대 더 많은 121만대가 팔렸다. 업계에서는 실시간 통화 통역, 생성형 AI를 활용한 사진 편집 등 갤럭시 S24에 최초로 탑재된 AI 기능 영향이 컸다고 평가했다.삼성전자와 SK텔레콤, KT, LG유플러스 등 이동통신3사는 26일 갤럭시 S24 사전 개통 시작과 함께 지난 19일부터 25일까지 진행한 사전 판매 결과를 발표했다.갤럭시 S24 시리즈는 일평균 사전 판매 기록도 갈아치웠다. 역대 최다 사전 판매량을 기록한 갤럭시 스마트폰은 2019년 8월 출시한 갤럭시 노트10(138만대)이였다. 하지만 일평균 사전 판매량을 비교하면 갤럭시 S24 시리즈는 17만3000여대인 반면 노트10은 12만5000여대였다.모델별 판매 비중을 살펴보면 121만대 중 울트라 비중은 약 60%였다. 플러스는 약 21%, 일반형은 19%였다.색상은 울트라 모델의 경우 티타늄 블랙이 가장 인기가 많았다. 플러스와 일반형은 마블 그레이의 인기가 높았다. 삼성닷컴, 삼성 강남 전용 인기 컬러는 티타늄 블루와 사파이어 블루였다.갤럭시 S24 시리즈 인기는 라이브커머스에도 입증됐다. 삼성전자는 언팩 이후 19일 자정에 진행했던 삼성닷컴 라이브 방송에서도 역대 최대 판매 신기록(2만여대)을 세웠다고 밝혔다.LG유플러스는 자사 라이브커머스 '유플러스라이브'에서 사전 예약 기간에 진행한 갤럭시 S24 판매 방송 시청자 수가 총 415만명이라며 전작 사전 예약 방송 대비 약 137% 증가했다고 전했다.사전 예약 혜택 중 하나인 더블 스토리지(저장용량 2배 업그레이드) 영향에 KT의 경우 울트라 1테라바이트(TB) 모델이 예판 하루 만에 매진되는 일이 있었다.또 LG유플러스는 이통사 단독 한정판으로 출시한 '댕댕이 에디션 위드 포동'이 경쟁률 6대 1을 기록하면서 1000대 모두 팔았다고 밝혔다.업계 일각에서는 이러한 인기 비결을 AI로 꼽았다. 삼성전자는 갤럭시 S24 시리즈를 AI폰의 시작으로 표현하면서 인터넷 연결 없이도 실시간으로 통화 내용을 통역하는 기능 등을 선보였다.구글과 협력해 동그라미만 치면 혁신적인 검색 경험을 제공하는 '서클 투 서치'도 탑재했다. 카메라의 경우 AI 모델을 대거 채용해 줌부터 나이토그래피까지 한층 더 완성된 카메라 경험을 만들었으며 생성형 편집 등 AI를 활용한 편집 기능도 대폭 강화됐다．",IT/과학,뉴시스
"애플, 유럽에서 다른 앱스토어·결제 수단 허용","오는 3월부터 유럽에서 아이폰 이용자는 애플의 앱스토어가 아닌 다른 앱스토어에서 앱을 다운받을 수 있고, 개발자는 아이폰의 인앱 결제가 아닌 다른 결제 수단을 제공할 수 있게 됩니다.애플은 현지시간 25일 이런 내용을 골자로 한 운영체제 iOS와 앱스토어, 웹브라우저 사파리 등에 대한 개편 계획을 발표했습니다.이번 조치는 3월부터 유럽연합에서 빅테크로 불리는 거대정보통신 기업의 폐쇄적인 플랫폼을 전면 개방하도록 한 디지털 시장법이 시행되는 데 따른 것입니다.애플은 우선 유럽에서 이용자들이 애플스토어가 아닌 다른 플랫폼에서도 앱을 다운받을 수 있게 된다고 밝혔습니다.애플은 그동안 구글과 달리 개인정보 보호 등을 이유로 애플스토어에서만 앱을 다운로드 받을 수 있게 허용해 왔습니다.애플의 결제 시스템이 아니라 앱 개발자들이 가격을 낮추면서 더 많은 수익을 낼 수 있는 대체 결제 시스템도 제공됩니다.애플은 이에 자사의 결제 시스템을 통한 거래에 대해 수수료를 15∼30%에서 10∼17%로 낮추기로 했습니다.대체 결제 시스템을 통한 거래는 기본적으로 수수료가 부과되지 않는데 이는 유럽에서만 해당할 뿐 그 외 지역에서는 그대로 부과됩니다.※ '당신의 제보가 뉴스가 됩니다'[카카오톡] YTN 검색해 채널 추가[전화] 02-398-8585[메일] social@ytn.co.kr",IT/과학,YTN
"미국 ""달에 큐브위성 보내주겠다"" 제안에…한국 ""예산 없어"" 거절","미국이 유인 달 탐사 프로젝트 '아르테미스 계획'의 일환으로 한국이 만든 큐브위성을 달에 보내주겠다고 제안했으나, 정작 한국 정부가 예산이 없다며 거절해 최종 무산된 것으로 확인됐습니다.정부가 미국 등 주요국과 우주협력을 강조하고 있지만 정작 예산 반영 등에는 미온적 태도를 보이며 아르테미스 계획을 비롯한 우주 협력에 참여할 의지가 없는 것 아니냔 비판이 나옵니다.오늘(26일) 우주 분야 복수 관계자들에 따르면 미국 항공우주국(NASA)은 지난해 10월 말 한국을 비롯해 아르테미스 계획에 참여하는 국가들에 현재 개발 중인 '아르테미스 2호'에 각국의 큐브위성을 실어 달로 보내는 프로젝트를 제안했습니다.큐브위성은 초소형 위성의 한 종류로 가로·세로·높이가 모두 10㎝인 정육면체를 하나의 '유닛(U)'으로 규격화한 위성입니다.과거에는 학생 교육용으로 활용돼 왔지만, 최근에는 소형위성 성능이 좋아지며 달이나 화성 탐사에도 쓰이고 있습니다.NASA는 우주비행사를 싣고 달 궤도를 도는 것을 목표로 하는 아르테미스 2호에 여분의 공간이 확보되자 협력 강화를 위해 각국 기관이나 기업에 달을 탐사할 큐브위성 탑재를 제안한 것으로 알려졌습니다.약 100억 원 규모 비용과 함께 큐브위성을 제작해 조달하면 이를 달에 실어 보내주겠다는 것입니다.우주분야 한 관계자는 ""큐브위성의 크기 등을 알아야 하지만, 달에 위성을 보내는 예산으로는 비싸다고 할 수 없다""고 말했습니다.아르테미스Ⅰ 로켓하지만 이런 제안을 받은 과학기술정보통신부는 시간이 촉박해 예산을 확보하기 어렵다며 NASA에 참여가 어렵다고 답했고, 결국 참여할 수 없다고 통보한 것으로 알려졌습니다.정부 예산안이 이미 국회에 제출된 상황에서 과기정통부에서 국회에 추가 예산을 제안했지만 결국 국회에서 최종 예산 반영이 되지 않았다는 것입니다.전승윤 과기정통부 뉴스페이스정책팀장은 ""개발할 수 있는 곳을 찾는 등 검토를 해서 예산을 만들어야 하는데 10월 말이면 국회 상임위 심사에 들어가야 하는 상황""이라며 ""우선순위상 다른 것들이 많아 최종 반영이 못 된 것 같다"" 설명했습니다.우주 산업계에서는 정부가 우주항공청 개청과 맞물려 아르테미스 계획 참여 프로젝트 등을 구체화하겠다는 것과는 달리 이런 기회를 놓치는 등 여전히 참여 의지가 없는 것 아니냔 비판이 나옵니다.우주기업 한 고위 관계자는 ""앞서 20년 전 미국이 국제우주정거장을 만들 때도 한국이 예산을 이유로 참여하지 못했는데, 여기에 참여한 캐나다는 우주정거장 로봇팔 분야에서 독보적 기술을 가져 지금은 미국이 프로젝트 참여를 애원하게 됐다""며 ""이번처럼 이런 기회를 계속 놓치면 미국이 지정하는 우주 분야 '티어1'(최상위) 그룹에 낄 기회가 없을 것""이라고 꼬집었습니다.정부가 우주 분야 육성을 강화하겠다고 했지만, 최근 연구개발(R&D) 예산 삭감에서 우주 분야 기업을 지원하는 '스페이스이노베이션' 사업 등이 대폭 삭감되는 등 현장에서는 전혀 다르게 느끼고 있단 목소리도 나옵니다.국내 6개 대학 우주항공 학부 연합체인 '천문우주항공 분야 유관 학과 공동행동'의 조현서 의장(연세대 천문우주학과)은 ""소통 없는 R&D 예산 삭감으로 천문 및 우주과학계 사기와 의지가 떨어진 상황에서 이런 소식은 정부에 대한 학생들의 신뢰를 더욱 저하한다""며 ""정부 차원에서 정책적으로 우주 분야에 대한 투자를 강화하겠다는 주장과 다르게, 현장에서는 이런 문제들이 발생하고 있어 유감스럽다""고 말했습니다.과기정통부가 이번 주 해외 출장길에 오른 조성경 과기정통부 1차관이 NASA와 만나 아르테미스 참여 확대를 논의한다고 밝혔지만, 여전히 구체적 협력 계획은 나오지 못할 거란 비판도 나옵니다.이상률 항우연 원장은 최근 과학기자단 대상 간담회에서 ""아르테미스 계획 참여 논의를 시작한 게 2017년부터였지만 아직 별다른 계획이 없는 것이 사실""이라고 말하기도 했습니다.(사진=NASA 제공, AP, 연합뉴스)",IT/과학,SBS
"""사이버공격 피해 92%가 중소기업""...국정원, IT 보안 지침 배포","지난해 사이버 공격에 의한 피해는 대부분 중소기업에 집중된 것으로 나타났습니다.한국인터넷진흥원은 지난해 사이버 공격으로 피해를 본 기업 가운데 92%가 중소기업이었다고 밝혔습니다.이에 대해 국정원은 중소기업이 보안에 투자하거나 보안 책임자를 둘 여력이 없는 사각지대에 있기 때문이라고 분석했습니다.이에 따라 국정원 산업기밀보호센터는 산업기술보호협회와 함께 중소기업이 해킹에 의한 기술 유출 피해를 당하지 않도록 정보기술 보안 지침을 발간, 배포했다고 밝혔습니다.국정원은 중소기업에서 많이 사용 중인 IT 장비와 소프트웨어를 대상으로 국내외에 발간된 수십 종의 중소기업 기술 보호 자료를 분석한 뒤 최신 보안 조치 방안을 담았다고 설명했습니다.※ '당신의 제보가 뉴스가 됩니다'[카카오톡] YTN 검색해 채널 추가[전화] 02-398-8585[메일] social@ytn.co.kr",IT/과학,YTN
"안랩클라우드, 18개 공공기관 67개 시스템 클라우드 전환 지원","안랩은 행정안전부가 총괄하고 NIA(한국지능정보사회진흥원)가 주관하는 '클라우드컴퓨팅서비스 활용모델 사업'을 수주하고, 총 18개 기관의 67개 정보시스템의 클라우드 전환 사업을 맡는다고 26일 밝혔다.수요기관 18곳에는 경제인문사회연구회와 연구회 소속 16개 연구기관, 한국도로공사 등이 있다. 이번 사업은 중앙행정기관, 지방자치단체 등 공공기관 중 수요를 희망하는 기관을 대상으로 민간사업자의 자본, 기술, 경험을 바탕으로 공공의 특성과 여건 등을 고려한 클라우드 기반 통합관리 환경 구축을 지원하는 사업이다.안랩은 다양한 수요기관 중 경제·인문사회연구회와 연구회 소속 16개 연구기관, 한국도로공사 등 총 18 개 기관이 사용 중인 67개 정보시스템을 PaaS(서비스형 플랫폼) 및 SaaS(서비스형 소프트웨어)형태로 전환하는 사업을 진행하게 됐다.안랩은 18개 수요 기관의 클라우드 전환을 총괄하는 주사업자로서 대상 기관들에 보안특화 클라우드 관리 서비스 '안랩 클라우드'가 제공하는 △클라우드 아키텍처 컨설팅 및 구축 △전문 모니터링 시스템을 활용한 클라우드 운영 관리 △'안랩 vAIPS', '안랩 vTMS', '안랩 CPP' 등 안랩 클라우드 보안 솔루션 추가 구축 등 클라우드 보안 통합 오퍼링을 제공한다. 또 고객이 원하면 네이버클라우드의 '하이퍼클로바 X' 등 AI(인공지능) 서비스를 고객환경에 맞춰 제안·도입·활용하기 위한 기술지원도 제공할 예정이다.이수한 경제·인문사회연구회 디지털전환추진단 단장은 ""경제·인문사회연구회는 정부의 다양한 공공부문 디지털전환 프로젝트에 적극적으로 임하고 있다""며, ""이번 사업에서 안랩의 기술력을 바탕으로 보다 안전하고 성공적인 클라우드 전환을 함께 만들어 나갈 것""이라고 말했다.최광호 안랩 클라우드사업본부 본부장은 ""안랩의 '안랩 클라우드'와 클라우드 보안 솔루션은 보안성과 안정성이 중요한 공공기관에서 주목받고 있다""며 ""안랩은 이번 사업에서도 각 기관의 환경을 고려한 최적의 서비스로 고객이 안전하게 클라우드를 활용할 수 있도록 최선을 다할 것""이라고 말했다.",IT/과학,머니투데이
제4통신사 선정 위한 주파수 경매 돌입…세종텔레콤 포기,"제4 통신사 선정을 위한 28기가 헤르츠 대역 경매 첫 날, 입찰 참여 업체 세 곳 중 한 곳인 세종 텔레콤이 중도 포기를 선언했습니다.  과학기술정보통신부는 오늘(25일) 오전 9시 반부터 서울 송파구에서 세종 텔레콤, 스테이지엑스. 마이모바일 등이 참여한 가운데 비공개로 시작된 경매가 오후 5시에 종료됐다고 밝혔습니다. 1단계 다중 라운드 오름 입찰 경매는 6라운드까지 진행됐으며, 내일 7라운드부터 재개됩니다.  현재 최고 입찰액은 757억 원입니다.  이번 경매는 오름 입찰 방식으로 최대 50라운드까지 진행되며, 이 과정에서 낙찰자가 정해지지 않으면 정부가 제시한 최소 입찰액을 검토한 뒤 가장 높은 금액을 제출한 사업자가 주파수를 할당받게 됩니다. 최근 과기정통부는 5G(파이브지) 28㎓ 대역 주파수 할당을 신청한 3개 법인의 입찰 참여 적격 여부를 검토했고, 3개 법인 모두 '적격'으로 판정해 통보했습니다.  경매를 통해 28기가 헤르츠 주파수 대역을 할당받으면 3년 차까지 전국에 기지국 6천 대를 의무적으로 구축하고, 주파수 혼·간섭 회피 조치를 이행해야 합니다.  과기부는 지난해 7월 통신 시장의 경쟁 구조 개선과 투자 활성화에 초점을 맞춰 제4 이동통신사 진입 유도 정책 등이 포함된 '통신시장 경쟁촉진 방안'을 발표한 바 있습니다.[사진 출처 : 연합뉴스]■ 제보하기▷ 전화 : 02-781-1234, 4444▷ 이메일 : kbs1234@kbs.co.kr▷ 카카오톡 : 'KBS제보' 검색, 채널 추가▷ 네이버, 유튜브에서 KBS뉴스를 구독해주세요!",IT/과학,KBS
"한국 아이폰 사용자는?…고개 숙인 애플, 다른 앱스토어·결제수단 허용","유럽 ‘빅테크 규제’ 대응 차원앱스토어 수수료도 인하 결정 생성형 이미지 플랫폼 미드저니로 만든 그림. 애플이 유럽연합의 규제에 백기를 든 모습을 표현해 달라고 요청했다. [사진 출처=미드저니]올해 3월부터 유럽에서 아이폰과 아이패드를 사용하는 이용자는 애플의 앱스토어가 아닌 다른 앱스토어에서 앱을 내려받을 수 있게 됐다. 또한 앱 개발자는 아이폰의 인앱 결제가 아닌 다른 결제 수단을 제공할 수 있을 뿐 아니라 앱 스토어 수수료도 인하된다.애플은 지난 25일(현지 시각) 이러한 내용이 담긴 iOS와 앱스토어 개편 계획을 발표했다. 이는 3월부터 시행되는 유럽연합(EU)의 빅테크 규제법인 ‘디지털시장법(DMA)’에 대한 대응 조치로 풀이된다. CNN은 애플의 이번 조치에 대해 “15년 전 애플의 독점 앱스토어가 만들어진 이후 애플의 앱 비즈니스에 가장 중요한 변화 중 일부를 반영한다”라고 평가했다.이번 변화로 이용자는 앱 구입과 설치에 있어서 더 많은 선택권을 가질 수 있게 된다. 개발자 역시 다양한 방식으로 마케팅을 시도할 수 있다.애플은 “사용자가 애플 자체 생태계 외부의 웹사이트에서 타사의 앱 스토어를 자신의 기기에 내려받을 수 있도록 허용할 것”이라며 “앱 스토어는 제3자 마켓플레이스에서 제공하는 다른 앱을 설치할 권한을 갖고 iOS 기기에 독립형 앱으로 존재할 것”이라고 설명했다.또한 애플은 인앱 거래에서 징수하는 수수료를 30%에서 17%로 낮추고, 애플을 통해 특정 할인 프로그램을 받을 자격이 있는 개발자의 경우 15%에서 10%로 인하하겠다고 제안했다.애플에 따르면 현재 EU 개발자 중 약 3%가 애플의 표준 30% 수수료를 지불하고 있으며, 9%는 할인된 수수료를 지불하고 있다. 나머지 88%의 개발자는 비용을 전혀 지급하지 않는다.다만 일부 제한은 존재한다. 다른 앱 스토어를 제공하는 개발자는 애플의 승인을 받아야 하며 또한 추가 결제 수수료 시스템도 도입한다는 방침이다. 애플의 결제 시스템을 이용할 시 3%의 결제 처리 수수료를 부과하고 100만번 이상 설치된 앱에 대해서는 설치 건당 0.50유로(725원)의 수수료를 부과한다는 방침이다. 애플은 “유럽 내 99% 이상의 개발자가 애플에 내는 수수료가 줄 것”이라며 “앱 설치 수수료를 내는 개발자는 전체의 1%도 되지 않는다”라고 밝혔다.",IT/과학,매일경제
"세종텔레콤, 경매 포기…제4이통 벌써 난기류","5G 28㎓ 주파수 경매 첫날스테이지엑스·마이모바일 2파전최고가 757억 그쳐…'눈치싸움'업계 ""무늬만 통신사 될 것"" 우려제4이동통신사 선정을 위한 5세대(5G) 28㎓ 주파수 경매가 25일 시작됐다. 참여 사업자 세 곳 중 한 곳은 경매를 중도 포기했다. 나머지 사업자 두 곳도 “출혈 경쟁은 하지 않겠다”고 입을 모았다. 경매 최저가에서 크게 벗어나지 않는 선에서 사업권을 쥐려는 눈치 싸움이 치열하다.○‘눈치 싸움’ 중 한 곳 먼저 포기과학기술정보통신부는 25일 서울 송파구 한국인터넷진흥원(KISA) 서울청사에서 1일차 주파수 경매를 진행했다. 정부가 제4통신사 출범을 위해 경매에 나서는 것은 이번이 여덟 번째다.경매 대상은 28㎓ 대역 800㎒ 폭이다. 통신 3사가 할당받았지만 제대로 활용하지 않아 할당이 취소된 주파수 대역 2400㎒ 중 800㎒다. 나머지 1600㎒는 이달 말 주파수 할당 계획을 발표할 때 구체적인 활용 방안을 공개할 전망이다.이날 경매엔 지난달 할당 신청을 한 세종텔레콤, 스테이지엑스(스테이지파이브), 마이모바일컨소시엄(미래모바일) 등 3개 사업자가 참여했다. 이들은 지난 9일 과기정통부로부터 할당 참여 적격 판정을 받았다.경매 최저가는 기존 낙찰가의 3분의 1 수준인 742억원이다. 오름입찰 방식으로 약 7일간 최대 50라운드까지 열린다. 50라운드까지 최종 승자를 가리지 못하면 밀봉입찰에 들어간다.첫날 경매는 6라운드까지 진행됐다. 각 라운드는 약 한 시간씩 걸린다. 사업자가 순서대로 10분씩 입찰가를 적어내고, 이를 정부가 검토하는 방식이다. 다음 라운드에선 직전 라운드 입찰가보다 최고 3% 높은 금액을 제출할 수 있다. 하지만 분위기는 ‘김빠진 콜라’에 가깝다는 평가가 나온다. 세종텔레콤이 경매 첫날부터 중도 포기를 선언했다. 과기정통부는 이날 경매 6라운드를 진행한 결과 757억원에 종료됐다고 밝혔다. 이튿날부터는 하루에 8라운드씩 열린다.○무늬만 통신사 될 수도통신업계는 이번 경매가 50라운드를 채우지 않고 조기 종료될 가능성이 높다고 보고 있다. 경매에 참여한 사업자 모두 자본금이 크게 넉넉하지 않은 중소사업자여서다. 경매 대상인 28㎓ 주파수는 사업성도 높지 않다. 낙찰 기업은 주파수 할당 후 3년 내 기지국 6000대를 구축해야 한다.윤호상 미래모바일 대표는 이날 경매장에 들어서면서 “소중한 전파자원을 합당한 가격에 할당받도록 공정하게 임하겠다”고 했다. 스테이지엑스도 과도한 경쟁은 피한다는 방침이다. 업계에선 최종 낙찰가가 약 800억~820억원 수준일 것으로 보고 있다.그런데도 업계에서는 ‘승자의 저주’ 가능성을 거론한다. 28㎓는 속도가 빠르지만 전파 도달 거리가 짧아 기지국 구축 비용이 많이 든다는 이유에서다. 5G 28㎓ 기지국은 구축비용이 대당 2000만~3000만원에 이른다. 여기에 추가로 설비를 더 들여야 기지국으로서의 기능을 할 수 있다. 통신 3사만 해도 비용 부담 등을 이유로 3년간 약 2000대를 구축하는 데 그쳤다.과기정통부는 어떻게든 제4 통신사를 유치하겠다며 지원 강도를 높이고 있다. 정부는 2010~2016년 일곱 차례에 걸쳐 제4 통신사 도입을 추진했지만 번번이 실패했다. 기지국 의무 구축분을 기존 통신 3사(각 1만5000대·총 4만5000대)의 절반 이하로 책정했다. 최대 4000억원의 정책 금융과 세액 공제도 제공하기로 했다.업계 관계자는 “당초 정부가 제4통신사 도입을 추진한 취지는 통신 3사 과점 체제를 깨고 건전한 경쟁을 유도하는 것이었다”며 “무늬만 통신사인 사업자가 나올 경우 시장 혼란을 부추길 수 있다”고 말했다.",IT/과학,한국경제
"NHN클라우드, 울산 지역 공공기관 대상 클라우드 전략 세미나 성료","NHN클라우드가 23일 울산 근로복지공단 본사에서 울산 지역 내 공공기관 IT 담당자와 관리자를 대상으로 클라우드 전략 세미나를 열었다.NHN클라우드가 지난 23일 울산 근로복지공단 본사에서 울산 지역 내 공공기관 IT 담당자, 관리자를 대상으로 클라우드 전략 세미나 '공공 클라우드 네이티브 전환을 위한 길잡이'를 개최했다.공공 클라우드 네이티브 전환 세미나는 NHN클라우드가 클라우드 전환을 고려하는 울산 지역의 공공 기관을 대상으로 클라우드 네이티브 전환을 위한 노하우를 제공하기 위해 이뤄졌다.NHN클라우드는 이 행사에서 △디지털 행정 공공 서비스의 변화와 클라우드 적용 사례 △클라우드 아키텍처 소개 △공공 클라우드 네이티브 전환 가이드 등 공공분야 클라우드 적용 사례와 클라우드 네이티브 전환 방안을 공유했다.먼저 '디지털 행정 공공 서비스의 변화와 클라우드 적용 사례' 세션에서는 공공 클라우드 정책 설명, 클라우드 전환 사업의 변화 과정, 주요 사례와 전망 등을 발표했다. 이어 '클라우드 아키텍처 소개' 발표에서는 NHN클라우드 특장점과 클라우드 주요 아키텍처, 보안 관제 적용 방안 등을 소개했다. '공공 클라우드 네이티브 전환 가이드' 세션에서는 클라우드 네이티브 구성요소와 개발방법론을 발표하고 적용사례, 공공 클라우드 네이티브 전환 가이드 등을 안내했다.김동훈 NHN클라우드 대표는 “이번 세미나는 울산시, 울산혁신도시 기관 고객과 만나 클라우드 네이티브 전환 고민에 대해 소통하고 해결책을 제시하기 위해 마련된 행사”라며 “다양한 고객 밀착형 행사로 고객이 성공적인 클라우드 네이티브 전환을 달성할 수 있도록 일조해 나갈 것”이라고 말했다.",IT/과학,전자신문
