Title,Article,Category,PressCompany
"갤럭시S24, 사전판매 121만대 기록…갤S 시리즈 중 최다","전작 109만대 판매 기록 뛰어넘어일평균 17만3000여대 판매...노트10 보다 많아첫 AI폰 마케팅 통해[이데일리 임유경 기자] 삼성전자(005930)는 지난 19일부터 25일까지 1주일간 진행한 갤럭시S24 시리즈의 국내 사전판매가 121만대를 기록했다고 26일 밝혔다.이는 역대 갤럭시S 시리즈 사전판매 중 최다 판매 신기록이다. 직전까지의 지난해 출시한 갤럭시S23 시리즈의 109만대 판매가 사전판매 최다 기록이었다. 갤럭시 스마트폰 중 역대 최다 사전판매 기록은 갤럭시 노트10이 가지고 있다. 이 모델은 2019년 8월 138만대의 사전판매를 기록한 바 있는데, 사전판매 기간이 11일이었다.일평균 기록을 비교하면, 1주일간 121만대를 사전판매한 갤럭시S24 시리즈가 일평균 17만3000여대로, 노트10의 12만5000여대를 넘어선다.갤럭시S24 시리즈의 대박 조짐은 언팩 직후부터 예감됐다. 삼성전자는 19일 자정, 사전판매의 시작과 함께 삼성닷컴에서 90여분간 라이브 방송을 진행했는데, 여기서도 약 2만여대를 판매하며 역대 최다 판매 신기록을 세운바 있다.갤럭시S24 시리즈 사전판매의 모델별 판매 비중을 살펴보면, 울트라가 약 60% 수준을 차지했다. 갤럭시 S24플러스는 약 21%, 갤럭시 S24는 약 19%의 판매 비중을 나타냈다.색상은 갤럭시S24 울트라는 경우 티타늄 블랙의 선호도가 높았고 갤럭시 S24플러스와 갤럭시S24는 마블 그레이 인기가 높았다. 삼성닷컴, 삼성 강남 전용 컬러 중에서는 티타늄 블루와 사파이어 블루의 인기가 높았다.갤럭시S24에서 처음 선보인 ‘갤럭시 AI’ 기능이 소비자의 마음을 사로잡는 데 성공한 것으로 보인다. 갤럭시S24는 13개 언어를 지원하는 실시간 통역과 문자 및 주요 메신저 번역을 지원한다. 또 화면에 동그라미만 그리면 관련 내용을 검색할 수 있는 ‘서클 투 서치’ 기능도 최초로 탑재됐다. 카메라에도 AI 모델을 대거 채용해 줌부터 나이토그래피까지 한층 더 완성된 카메라 경험 제공하며, 생성형 편집 등 AI를 활용한 편집 기능도 대폭 강화됐다.사전 구매 고객은 26일부터 제품 수령과 개통이 가능하며, 개통 후 ‘삼성닷컴’ 앱에서 구매 혜택을 신청할 수 있다. 글로벌 공식 출시일은 오는 31일이다.",IT/과학,이데일리
애플 “타사 앱스토어에서 내려받아도 되지만 돈은 내”,"애플은 EU의 빅테크 규제법 시행으로 외부 플랫폼에서의 앱 다운로드를 허용하되, 애플이 앱을 검증할 수 있는 권한을 부여할 방침이다. 사진=로이터 연합뉴스애플이 유럽 사용자를 상대로 소프트웨어 관련 새로운 수수료 정책 및 관리 규제를 추가할 계획이다.24일(현지시간) 월스트리트저널에 따르면 이는 3월 시행을 앞둔 유럽연합(EU)의 빅테크 규제법인 디지털시장법(DMA)이 자사 전속 앱스토어 외 다른 플랫폼에서도 앱을 다운로드할 수 있도록 허용한 데 따른 조처다.보도에 따르면 애플은 EU의 빅테크 규제법 시행으로 외부 플랫폼에서의 앱 다운로드를 허용하되, 애플이 앱을 검증할 수 있는 권한을 부여할 방침이다.또한 애플 앱스토어가 아닌 타 플랫폼에서 내려받은 앱에 대해서도 결제 시 개발자로부터 수수료를 받을 계획이다.EU의 빅테크 규제법 시행에도 불구하고 '애플 생태계' 바깥의 소프트웨어를 상대로 여전히 강한 통제력을 행사하겠다는 의미다.애플의 이 같은 계획은 빅테크 규제법 시행으로 높은 수수료 없이 앱 출시를 기대했던 앱 개발자들의 반발을 불러일으킬 수 있다고 WSJ은 분석했다.",IT/과학,전자신문
제4이통사 주파수 경매 2파전…세종텔레콤 포기,"[서울경제] 5세대 이동통신(5G) 28㎓(기가헤르츠) 주파수 대역을 할당받을 신규 기간통신사업자, 이른바 제4이동통신사를 선정하기 위한 주파수 경매가 개시 하루 만에 기존 3파전에서 2파전으로 좁혀졌다.과학기술정보통신부는 25일 서울 송파구 IT벤처타워에서 세종텔레콤, 스테이지엑스, 마이모바일 등 제4이통사 후보 업체 3곳을 대상으로 28㎓ 주파수 경매를 진행한 결과 세종텔레콤이 중도 포기했다고 밝혔다.첫날 입찰가는 757억 원으로 마감했다. 스테이지엑스와 마이모바일은 이튿날인 26일 오전 9시부터 입찰을 계속하게 된다.",IT/과학,서울경제
“한번 충전 1000km 달리는 꿈의 전기차” ‘젤’로 만든 배터리로 만든다,"- POSTECH 박수진 교수팀, 일체형 실리콘-젤 전해질 시스템 개발전기차.[게티이미지뱅크][헤럴드경제=구본혁 기자] 지금껏 출시된 전기차의 최대 주행거리는 700km에 불과하다. 전세계 연구자들의 목표는 1회 충전으로 1000km를 달리는 전기차다. 이를 위해 전기차에 사용되는 리튬이온 배터리 음극재로 저장 용량이 큰 실리콘을 활용하려는 연구가 활발하게 진행되고 있지만, 아직 상용화에 어려움이 많다.포스텍(POSTECH) 화학과 박수진 교수 연구팀은 젤(gel) 형태의 고분자 전해질을 사용해 저렴하면서도 안정적인 마이크로 실리콘 기반 차세대 고에너지 밀도 리튬이온 배터리 시스템을 개발했다.실리콘 음극재는 충·방전 시 부피가 3배 이상 팽창하고 수축하기 때문에 배터리 효율이 크게 떨어진다. 이에 값비싼 나노(10-9m) 실리콘을 활용하면 문제를 일부 해결할 수 있지만, 제조 공정이 매우 복잡하고 까다로우며 천문학적인 비용이 필요하다. 반면, 마이크로(10-6m) 실리콘의 경우 가격과 에너지 밀도 측면에서 실용성은 비교적 높지만, 배터리 작동 중에 발생하는 부피 팽창 문제가 더욱 극심하게 나타나 음극재로 사용하기에 한계가 있었다.경제적이면서도 안정적인 실리콘 기반 배터리 시스템을 개발하기 위해 연구팀은 젤 전해질을 사용했다. 리튬이온 배터리 내 전해질은 이온이 양극과 음극을 오고 갈 수 있는 중요한 요소다. 젤 전해질은 액체 형태의 일반적인 전해질과 달리 고체나 젤 상태로 존재하는데, 탄성이 있는 고분자 구조를 가져 액체 전해질에 비해 안정성이 높다.전자빔 조사 공정을 통한 마이크로 실리콘과 젤 전해질 간 공유 결합 형성 모식도.[포스텍 제공]연구팀은 전자빔을 쏘아 마이크로 실리콘 입자와 젤 전해질 간 공유 결합을 형성했다. 이 공유 결합은 리튬이온 배터리 구동 중 부피 팽창으로 인한 내부 응력을 분산시켜 마이크로 실리콘 부피 변화를 완화해 구조적 안정성을 높였다.그 결과, 기존 나노 실리콘 음극재에 비해 100배 큰 마이크로 실리콘 입자(5μm)를 사용함에도 안정적인 전지 구동력을 보였다. 또한 실리콘-젤 전해질 시스템은 액체 전해질을 사용한 기존 전지와 유사한 이온 전도도를 보였으며, 에너지 밀도는 약 40% 향상됐다. 연구팀의 시스템은 현재 바로 적용할 수 있는 간단한 공정이라는 점에서도 큰 의의가 있다.박수진 교수는 “마이크로 실리콘 음극재를 사용했음에도 불구하고 구조적 안정성을 크게 증진시켰다”며 “이번 연구를 통해 실용적인 고에너지 밀도 리튬이온 배터리 시스템에 한 발 더 다가섰다”고 전했다.이번 연구성과는 국제학술지 ‘어드밴스드 사이언스(Advanced Science)’ 1월 17일 온라인 게재됐다.",IT/과학,헤럴드경제
"네이버, B2B 시장 확장 포석…‘프리즘 라이브 스튜디오’ 기업용 상품 출시","[ⓒ네이버][디지털데일리 왕진화 기자] 네이버 모바일 라이브 스트리밍 앱 ‘프리즘 라이브 스튜디오’가 기업간거래(B2B) 시장에 나선다. 네이버는 보다 고도화된 기술력을 바탕으로 기업 고객의 니즈에 맞춘 상품을 선보임으로써 글로벌 라이브 기술력의 외연을 확장할 계획이다.네이버(대표 최수연)는 동영상 라이브 플랫폼 기술력이 집약된 ‘프리즘 라이브 스튜디오’ 모바일 앱의 B2B 상품을 출시한다고 25일 밝혔다. 이는 B2B 기술 솔루션을 모아 소개하는 네이버 클라우드 플랫폼에서 선보여진다.지난 2019년 3월 출시된 프리즘 라이브 스튜디오는 PC와 모바일 환경에서 동영상 라이브 스트리밍 송출과 동영상 편집 기능을 제공하는 멀티 플랫폼이다.일반 이용자들도 전문가처럼 편리하게 라이브 스트리밍을 송출할 수 있다. 네이버 쇼핑라이브, 치지직, 밴드, 네이버TV를 비롯해 유튜브나 페이스북 등 글로벌 라이브 플랫폼에서의 스트리밍 송출도 지원한다.네이버에 따르면 전세계 200여개국에서 프리즘 라이브 스튜디오를 사용하고 있으며 해외 유저 비중이 90%에 달한다. 네이버는 자체 라이브 클라우드인 ‘네이버 라이브 클라우드’를 바탕으로 외부 서비스에서도 안정적인 송출 환경과 기능을 제공 중이다.데이터에이아이(Data.ai)에 따르면, 이 앱은 올해 1월 기준 구글플레이 및 앱스토어 모바일 스트리밍 앱 다운로드 규모 1위를 기록하고 있다. 사용자 기기에서 이뤄지는 카메라 라이브나 게이밍 라이브 스트리밍에 활용되는 스크린 캐스트, 가상 아바타를 앞세워 진행하는 캐릭터 라이브 스트리밍이 모두 지원된다.이 밖에도 네이버는 PC 환경과 모바일 앱 간 자유로운 연결을 지원하는 ‘리모콘 기능’과 각종 이펙트, RTMP(Real Time Messaging Protocol) 오버레이 적용 등 스트리밍 관련 기능을 꾸준히 고도화해 왔다.B2B 전용 앱은 기존 모바일 앱에서 제공하던 모든 기능이 자동으로 연동될 뿐 아니라, 기업 고객이 운영하고 있는 스트리밍 서비스나 솔루션에 맞게 커스터마이징한 통합 솔루션 개발이 가능하고 운영의 효율성도 높일 수 있다. 네이버는 이를 통해 인프라나 개발 인력이 부족한 기업들도 손쉽게 라이브 스트리밍 서비스를 구축할 수 있을 것으로 기대하고 있다.그간 네이버는 프리즘 라이브 스튜디오 송출과 미디어 서버, 스트리밍 등 라이브 방송에 필요한 단계별 기술 컴포넌트를 통합 개발하고 관리하는 글로벌 라이브 기술 플랫폼인 ‘프리즘(PRISM)’을 중심으로 관련 기술을 강화해왔다.또한, 실시간으로 네트워크 상태를 예측해 상황에 맞는 최적화된 액션을 결정하는 송출기술 ABP(Adaptive Bitrate Publish)1)와 HEVC(High Efficiency Video Coding, H.265) 코덱2)을 적용해 고화질 라이브 스트리밍을 제공했다.자체 개발한 ULL(Ultra Low Latency) 기술이 탑재된 ‘리얼타임모드’는 지연속도(latency)를 10초에서 2초대로 줄여 실시간 송출이 가능해 글로벌 브랜드의 대형 쇼핑 행사나 K-POP 콘서트도 실시간으로 시청할 수 있다.송지철 네이버 프리즘 스튜디오 개발 리더는 “프리즘 라이브 스튜디오는 출시 이후 꾸준한 기능 개선 및 기술 고도화로 글로벌 라이브 스트리밍 시장에서 꼭 필요한 앱으로 많은 이용자들의 선택을 받고 있다”며 “B2B 상품 출시를 바탕으로 기업용 개발에 나서 네이버의 우수한 기술력을 더욱 확대하겠다”고 말했다.",IT/과학,디지털데일리
"“달에 큐브위성 보내주겠다"" 美 제안 거절한 한국…“예산 없어”   ","NASA, ‘아르테미스 2호’에 한국 큐브위성 탑재 제안한국, 약 100억 원 규모 예산 확보 실패로 무산우주업계 ""우주분야 최상위 그룹 낄 기회 놓쳐” 비판미국 항공우주국(NASA)이 유인 탐사선으로 달 궤도를 도는 아르테미스 프로그램 2단계 계획(아르테미스Ⅱ)을 내년 9월로, 우주비행사를 달에 착륙시키는 3단계(아르테미스Ⅲ) 계획을 2026년 9월로 연기한다고 지난 9일(현지시간) 밝혔다. 사진은 2022년 6월 14일 NASA 케네디 우주센터의 아르테미스Ⅰ대형 로켓 우주발사시스템(SLS)과 오리온 우주선 뒤로 보름달이 뜬 모습. NASA 제공. 연합뉴스미국이 유인 달 탐사 프로젝트 '아르테미스 계획'의 일환으로 “한국이 만든 큐브위성을 달에 보내주겠다”고 제안했으나, 정작 한국 정부가 “예산이 없다”며 거절해 최종 무산된 것으로 확인됐다. 정부가 미국 등 주요국과 우주협력을 강조하고 있지만, 정작 예산 반영 등에는 미온적 태도를 보이며 아르테미스 계획을 비롯한 우주 협력에 참여할 의지가 없는 것 아니냔 비판이 나온다.26일 우주 분야 복수 관계자들에 따르면 미국 항공우주국(NASA)은 지난해 10월 말 한국을 비롯해 아르테미스 계획에 참여하는 국가들에 현재 개발 중인 '아르테미스 2호'에 각국의 큐브위성을 실어 달로 보내는 프로젝트를 제안했다.큐브위성은 초소형 위성의 한 종류로 가로·세로·높이가 모두 10cm인 정육면체를 하나의 '유닛(U)'으로 규격화한 위성이다. 과거에는 학생 교육용으로 활용돼 왔지만, 최근에는 소형위성 성능이 좋아지며 달이나 화성 탐사에도 쓰이고 있다.NASA는 우주비행사를 싣고 달 궤도를 도는 것을 목표로 하는 ‘아르테미스 2호’에 여분의 공간이 확보되자 협력 강화를 위해 각국 기관이나 기업에 달을 탐사할 큐브위성 탑재를 제안한 것으로 알려졌다. 약 100억 원 규모 비용과 함께 큐브위성을 제작해 조달하면 이를 달에 실어 보내주겠다는 것이다.우주분야 한 관계자는 ""큐브위성의 크기 등을 알아야 하지만, 달에 위성을 보내는 예산으로는 비싸다고 할 수 없다""고 말했다.하지만 이런 제안을 받은 과학기술정보통신부는 “시간이 촉박해 예산을 확보하기 어렵다”며 NASA에 참여가 어렵다고 답했고, 결국 참여할 수 없다고 통보한 것으로 알려졌다. 정부 예산안이 이미 국회에 제출된 상황에서 과기정통부에서 국회에 추가 예산을 제안했지만, 결국 국회에서 최종 예산 반영이 되지 않았다는 것이다.전승윤 과기정통부 뉴스페이스정책팀장은 ""개발할 수 있는 곳을 찾는 등 검토를 해서 예산을 만들어야 하는데, 10월 말이면 국회 상임위 심사에 들어가야 하는 상황""이라며 ""우선순위상 다른 것들이 많아 최종 반영이 못 된 것 같다"" 설명했다.우주 산업계에서는 정부가 우주항공청 개청과 맞물려 아르테미스 계획 참여 프로젝트 등을 구체화하겠다는 것과는 달리 이런 기회를 놓치는 등 여전히 참여 의지가 없는 것 아니냔 비판이 나온다.우주기업 한 고위 관계자는 ""앞서 20년 전 미국이 국제우주정거장을 만들 때도 한국이 예산을 이유로 참여하지 못했는데, 여기에 참여한 캐나다는 우주정거장 로봇팔 분야에서 독보적 기술을 가져 지금은 미국이 프로젝트 참여를 애원하게 됐다""며 ""이번처럼 이런 기회를 계속 놓치면 미국이 지정하는 우주 분야 '티어1'(최상위) 그룹에 낄 기회가 없을 것""이라고 꼬집었다.정부가 우주 분야 육성을 강화하겠다고 했지만, 최근 연구개발(R&D) 예산 삭감에서 우주 분야 기업을 지원하는 '스페이스이노베이션' 사업 등이 대폭 삭감되는 등 현장에서는 전혀 다르게 느끼고 있단 목소리도 나온다.국내 6개 대학 우주항공 학부 연합체인 '천문우주항공 분야 유관 학과 공동행동'의 조현서 의장(연세대 천문우주학과)은 ""소통 없는 R&D 예산 삭감으로 천문 및 우주과학계 사기와 의지가 떨어진 상황에서 이런 소식은 정부에 대한 학생들의 신뢰를 더욱 저하한다""며 ""정부 차원에서 정책적으로 우주 분야에 대한 투자를 강화하겠다는 주장과 다르게, 현장에서는 이런 문제들이 발생하고 있어 유감스럽다""고 말했다.과기정통부가 이번 주 해외 출장길에 오른 조성경 과기정통부 1차관이 NASA와 만나 아르테미스 참여 확대를 논의한다고 밝혔지만, 여전히 구체적 협력 계획은 나오지 못할 거란 비판도 나온다.이상률 항우연 원장은 최근 과학기자단 대상 간담회에서 ""아르테미스 계획 참여 논의를 시작한 게 2017년부터였지만 아직 별다른 계획이 없는 것이 사실""이라고 말하기도 했다.",IT/과학,부산일보
갤럭시S24 구매 지원금보단 선택약정 유리,"갤럭시S24 통신사별 공시지원금. [ⓒ 각 사, 디지털데일리][디지털데일리 채성오 기자] 이동통신 3사가 갤럭시S24 시리즈 개통일에 맞춰 공시지원금을 확정한 가운데, 지난주 공시한 예상 금액과 동일 수준의 지원금이 책정돼 선택약정할인(요금의 25% 할인)에 수요가 몰릴 것으로 관측되고 있다. 법에서 정한 보조금 이상을 지원하는 이른바 '성지'에 대한 관심도 집중되는 모습이다.26일 SK텔레콤, KT, LG유플러스는 각각 갤럭시S24 시리즈 공시지원금을 확정·공개했다. 이날 확정된 공시지원금을 보면, 지난 19일 공개한 예상 지원금과 큰 차이를 보이지 않았다.KT는 월 4만5000원 요금제인 '5G 세이브'를 선택하면 8만5000원의 지원금을 제공하며 최고 요금제인 '초이스 프리미엄(월 13만원)' 가입 시 24만원의 공시지원금을 지원한다. 초이스 프리미엄 요금제를 선택하면 24만원의 공시지원금을 받는 정책은 지난 19일 KT가 공개한 예상 범위와 같다.SK텔레콤과 LG유플러스도 예상 지원금과 비슷한 수준의 공시지원금을 책정했다. 다만 SK텔레콤의 경우 최저 구간(월 4만9000원 베이직 요금제 가입시 10만원 지원)은 예상 지원금과 동일했으나 최고 요금제(월 12만5000원 5GX플래티넘) 선택 시 지원하는 금액이 3만원 오른 20만원으로 책정됐다.LG유플러스는 월 13만원 요금제인 '5G 시그니처' 기준 23만원의 공시지원금을 책정해 예상지원금과 동일했으며 '5G 슬림+(월 4만7000원)' 요금제 선택 시 8만5000원을 지원하는 것으로 결정했다.공시지원금 확대폭이 미미한 수준으로 책정되자, 선택약정할인에 대한 관심이 높아지고 있다. 사실상 해당 단말기에 대한 공시지원금이 확대될 가능성이 제기되기도 했지만 끝내 현실화되지 못했기 때문이다.특히 앞서 지난 22일 정부가 민생토론회를 통해 '이동통신단말장치 유통구조 개선에 관한 법률(이하 단통법)'을 폐지하겠다고 발표한 데다 윤석열 대통령이 ""단통법 폐지 이전이라도 사업자간 마케팅 경쟁 활성화를 통해 단말기 가격이 실질적으로 인하될 수 있는 방안을 강구하라""는 주문이 이어지자 갤럭시S24 공시지원금 확대 기대감이 고조되기 시작했다.그러나 최고 요금제 구간 기준 SK텔레콤의 공시지원금만 예상보다 3만원 높게 책정됐고, 이마저도 3사 중 가장 낮은 수준이라 선택약정이 유리할 것이라는 관측이 우세하다. 가장 많은 공시지원금을 받으려면 2년 약정 기준 300만원이 넘는 통신비를 내야하는 결론에 도달한다.공시지원금 규모의 변화가 미미하자, 소비자들의 관심은 선택약정과 '성지'에 집중되는 모습이다. 선택약정 할인을 선택하면 월 13만원 상당 최고 요금제(2년 약정) 기준 최대 78만원 가량의 요금 할인을 받을 수 있으며 월 4만원대 요금제로 가입할 경우 최대 29만원 수준의 요금 할인이 가능하다.한편, 갤럭시S24 시리즈의 출고가는 256GB 기준 ▲갤럭시S24 115만5000원 ▲갤럭시S24+ 135만3000원 ▲갤럭시S24 울트라 169만8400원으로 책정됐으며 오는 31일 정식 출시될 예정이다.",IT/과학,디지털데일리
"안랩, 국내 18개 기관 클라우드 전환 사업 수주","'2023년도 클라우드컴퓨팅서비스 활용모델 사업' 수주""경제·인문사회연구회, 한국도로공사 등 PaaS·SaaS 전환""안랩 CI(사진=안랩 제공) *재판매 및 DB 금지[서울=뉴시스]송혜리 기자 = 안랩은 행정안전부가 총괄하고 한국지능정보사회진흥원(NIA)이 주관하는 '2023년도 클라우드컴퓨팅서비스 활용모델 사업'을 수주해 총 18개 기관에서 사용 중인 67개 정보시스템의 클라우드 전환 사업을 맡는다고 26일 밝혔다. '클라우드컴퓨팅서비스 활용모델 사업'은 디지털 환경에 발맞춰 국민에게 신속하고 안정적인 행정 서비스를 제공하기 위한 사업으로 수요기관의 서비스 인프라를 클라우드 방식으로 전환하는 것이 핵심이다.안랩은 다양한 수요기관 중 경제·인문사회연구회와 연구회 소속 16개 연구기관, 한국도로공사 등 총 18개 기관이 사용 중인 67개 정보시스템을 서비스형플랫폼(PaaS)과 서비스형소프트웨어(SaaS)형태로 전환하는 사업을 진행하게 됐다.안랩은 18개 수요 기관의 클라우드 전환을 총괄하는 주 사업자로서 대상 기관들에 '안랩 클라우드'가 제공하는 ▲클라우드 아키텍처 컨설팅 및 구축 ▲전문 모니터링 시스템을 활용한 클라우드 운영 관리와 함께 ▲안랩 vAIPS·안랩 vTMS·안랩 CPP 등을 제공한다. 아울러 고객이 원할 시 네이버클라우드의 '하이퍼클로바 X' 등 인공지능(AI) 서비스를 고객환경에 맞춰 제안·도입·활용하기 위한 기술지원도 제공할 예정이다.최광호 안랩 클라우드사업본부장은 ""'안랩 클라우드'와 클라우드 보안 솔루션은 보안성과 안정성이 중요한 공공기관에서 주목받고 있다""며 ""이번 사업에서도 각 기관의 환경을 고려한 최적의 서비스로 고객이 안전하게 클라우드를 활용할 수 있도록 최선을 다할 것""이라고 말했다.",IT/과학,뉴시스
"갤럭시 S24, 사전판매 ‘신기록’…일주일 만에 121만대 팔렸다","S23 109만대 넘으며 S시리즈 최다“갤럭시 AI 기능으로 소비자 공략” 지난 21일 오후 시민들이 서울 서초구 센트럴시티에 마련된 삼성전자 갤럭시S24 체험공간인 ‘갤럭시 스튜디오’를 둘러보고 있다. [사진 = 이충우 기자]삼성전자의 첫 인공지능(AI) 스마트폰 ‘갤럭시 S24 시리즈’가 역대 갤럭시 S 시리즈 사전 판매 중 최다 판매 신기록을 썼다.삼성전자는 19일부터 25일까지 1주일간 진행한 갤럭시 S24의 국내 사전 판매가 121만대를 기록했다고 26일 밝혔다.S 시리즈 통틀어 최다 사전 판매를 기록하면서, 전작인 갤럭시 S23이 갖고 있던 사전 판매 기록을 뛰어넘었다. 갤럭시 S23 시리즈는 지난해 1주일간 109만대 판매량을 기록한 바 있다.일 평균 판매량으로 보면 갤럭시 S24가 갤럭시 스마트폰 역대 최다다. 현재 최다 사전 판매 기록은 138만대가 팔린 갤럭시 노트10이 갖고 있는데, 해당 모델은 사전 판매 기간이 11일이었다.1주일간 121만대가 판매된 갤럭시 S24 시리즈의 일평균 판매량은 17만3000여대로, 노트10의 12만5000여대를 훌쩍 넘었다.이번 사전 판매에서는 갤럭시 S24 울트라 모델이 약 60%를 차지하며 가장 많은 선택을 받았다. 이어 갤럭시 S24 플러스가 21%, 갤럭시 S24가 19% 수준이었다.색상은 울트라 모델의 경우 티타늄 블랙이 가장 인기 있었으며, 플러스 모델과 일반 모델은 마블 그레이 색상이 많이 팔렸다. 삼성 강남 전용 컬러 중에서는 티타늄 블루와 사파이어 블루의 인기가 높았다.삼성전자 관계자는 “갤럭시 S24 시리즈에서 처음 선보인 갤럭시 AI 기능을 비롯해, 모든 사용성에서 한층 더 강력해진 성능이 소비자의 마음을 사로잡는 데 성공한 것으로 보인다”고 말했다.갤럭시 S24 시리즈는 13개 언어를 지원하는 실시간 통역과 함께, 문자와 메신저 번역, 녹음 파일 텍스트 전환과 같은 다양한 AI 기능을 제공한다.사전 판매 고객의 경우 26일부터 제품 수령과 개통이 진행되며, 공식 출시일은 31일이다.",IT/과학,매일경제
