Title,Article,Category,PressCompany
"세종텔레콤, 경매 포기…제4이통 벌써 난기류","5G 28㎓ 주파수 경매 첫날스테이지엑스·마이모바일 2파전최고가 757억 그쳐…'눈치싸움'업계 ""무늬만 통신사 될 것"" 우려제4이동통신사 선정을 위한 5세대(5G) 28㎓ 주파수 경매가 25일 시작됐다. 참여 사업자 세 곳 중 한 곳은 경매를 중도 포기했다. 나머지 사업자 두 곳도 “출혈 경쟁은 하지 않겠다”고 입을 모았다. 경매 최저가에서 크게 벗어나지 않는 선에서 사업권을 쥐려는 눈치 싸움이 치열하다.○‘눈치 싸움’ 중 한 곳 먼저 포기과학기술정보통신부는 25일 서울 송파구 한국인터넷진흥원(KISA) 서울청사에서 1일차 주파수 경매를 진행했다. 정부가 제4통신사 출범을 위해 경매에 나서는 것은 이번이 여덟 번째다.경매 대상은 28㎓ 대역 800㎒ 폭이다. 통신 3사가 할당받았지만 제대로 활용하지 않아 할당이 취소된 주파수 대역 2400㎒ 중 800㎒다. 나머지 1600㎒는 이달 말 주파수 할당 계획을 발표할 때 구체적인 활용 방안을 공개할 전망이다.이날 경매엔 지난달 할당 신청을 한 세종텔레콤, 스테이지엑스(스테이지파이브), 마이모바일컨소시엄(미래모바일) 등 3개 사업자가 참여했다. 이들은 지난 9일 과기정통부로부터 할당 참여 적격 판정을 받았다.경매 최저가는 기존 낙찰가의 3분의 1 수준인 742억원이다. 오름입찰 방식으로 약 7일간 최대 50라운드까지 열린다. 50라운드까지 최종 승자를 가리지 못하면 밀봉입찰에 들어간다.첫날 경매는 6라운드까지 진행됐다. 각 라운드는 약 한 시간씩 걸린다. 사업자가 순서대로 10분씩 입찰가를 적어내고, 이를 정부가 검토하는 방식이다. 다음 라운드에선 직전 라운드 입찰가보다 최고 3% 높은 금액을 제출할 수 있다. 하지만 분위기는 ‘김빠진 콜라’에 가깝다는 평가가 나온다. 세종텔레콤이 경매 첫날부터 중도 포기를 선언했다. 과기정통부는 이날 경매 6라운드를 진행한 결과 757억원에 종료됐다고 밝혔다. 이튿날부터는 하루에 8라운드씩 열린다.○무늬만 통신사 될 수도통신업계는 이번 경매가 50라운드를 채우지 않고 조기 종료될 가능성이 높다고 보고 있다. 경매에 참여한 사업자 모두 자본금이 크게 넉넉하지 않은 중소사업자여서다. 경매 대상인 28㎓ 주파수는 사업성도 높지 않다. 낙찰 기업은 주파수 할당 후 3년 내 기지국 6000대를 구축해야 한다.윤호상 미래모바일 대표는 이날 경매장에 들어서면서 “소중한 전파자원을 합당한 가격에 할당받도록 공정하게 임하겠다”고 했다. 스테이지엑스도 과도한 경쟁은 피한다는 방침이다. 업계에선 최종 낙찰가가 약 800억~820억원 수준일 것으로 보고 있다.그런데도 업계에서는 ‘승자의 저주’ 가능성을 거론한다. 28㎓는 속도가 빠르지만 전파 도달 거리가 짧아 기지국 구축 비용이 많이 든다는 이유에서다. 5G 28㎓ 기지국은 구축비용이 대당 2000만~3000만원에 이른다. 여기에 추가로 설비를 더 들여야 기지국으로서의 기능을 할 수 있다. 통신 3사만 해도 비용 부담 등을 이유로 3년간 약 2000대를 구축하는 데 그쳤다.과기정통부는 어떻게든 제4 통신사를 유치하겠다며 지원 강도를 높이고 있다. 정부는 2010~2016년 일곱 차례에 걸쳐 제4 통신사 도입을 추진했지만 번번이 실패했다. 기지국 의무 구축분을 기존 통신 3사(각 1만5000대·총 4만5000대)의 절반 이하로 책정했다. 최대 4000억원의 정책 금융과 세액 공제도 제공하기로 했다.업계 관계자는 “당초 정부가 제4통신사 도입을 추진한 취지는 통신 3사 과점 체제를 깨고 건전한 경쟁을 유도하는 것이었다”며 “무늬만 통신사인 사업자가 나올 경우 시장 혼란을 부추길 수 있다”고 말했다.",IT/과학,한국경제
"[G-브리핑] 라이엇게임즈, TFT 콘텐츠 확장 계획 공개","TFT라이엇 게임즈가 ‘리그 오브 레전드(이하 LoL)’ 세계관 기반 전략 게임 ‘전략적 팀 전투(Teamfight Tactics, 이하 TFT)’의 콘텐츠 확장 계획을 공개했다.라이엇 게임즈는 정규 세트 외에도 누구나 쉽게 즐길 수 있는 콘텐츠를 선보인다. 2020년 출시한 세트 3.5를 재해석한 ‘부활: 갤럭시’를 시작으로 플레이어에게 호평받은 콘텐츠에 새로운 시스템을 결합한다.플레이어는 세트 3.5를 상징하는 챔피언(다리우스, 블리츠크랭크 등)과 차원문의 전신인 은하계 외에도 증강 등 최신 시스템이 더해진 콘텐츠를 즐길 수 있다.결투장도 새로운 모습으로 등장하며 5단계 3성 유닛 스킬이 조정되고 전체 유닛 수가 늘어나 플레이어의 부담을 완화한다. 이번 세트의 랭크 게임은 정규 세트와 별도로 진행된다.이용자는 25일부터 ▲미니 프레스티지 용의 권 리 신 ▲미니 칠현금 소나 ▲미니 도자기 럭스 등 다양한 콘텐츠도 즐길 수 있다.◆ NHN클라우드, ‘찾아가는 클라우드 전략 세미나’ 진행NHN클라우드 ‘찾아가는 클라우드 전략 세미나’엔에이치엔 클라우드(대표 김동훈, 이하 NHN클라우드)가 공공기관 고객을 위해 ‘찾아가는 클라우드 전략 세미나’를 진행했다.NHN클라우드가 지난 23일 울산 근로복지공단 본사에서 울산 지역 내 공공기관 IT 담당자 및 관리자를 대상으로 클라우드 전략 세미나 ‘공공 클라우드 네이티브 전환을 위한 길잡이(이하 공공 클라우드 네이티브 전환 세미나)’를 열고 성료했다고 25일 밝혔다.공공 클라우드 네이티브 전환 세미나는 NHN클라우드가 클라우드 전환을 고려하는 울산 지역의 공공 기관을 대상으로 클라우드 네이티브 전환을 위한 노하우를 제공하기 위해 이뤄졌다.이 행사에서 NHN클라우드는 ▲디지털 행정 공공 서비스의 변화와 클라우드 적용 사례 ▲클라우드 아키텍처 소개 ▲공공 클라우드 네이티브 전환 가이드 등 공공분야 클라우드 적용 사례와 클라우드 네이티브 전환 방안 중심의 클라우드 전략을 공유했다.‘디지털 행정 공공 서비스의 변화와 클라우드 적용 사례’ 세션에서는 공공 클라우드 정책 설명, 클라우드 전환 사업의 변화 과정 및 주요 사례와 전망 등을 발표했다.이어서 ‘클라우드 아키텍처 소개’ 발표에서는 NHN클라우드 특장점과 클라우드 주요 아키텍처, 보안 관제 적용 방안 등을 소개했다.끝으로 ‘공공 클라우드 네이티브 전환 가이드’ 세션에서는 클라우드 네이티브 구성요소 및 개발방법론을 발표하고 적용사례, 공공 클라우드 네이티브 전환 가이드 등을 안내했다.또한 NHN클라우드는 발표 세션 이후 질의응답 및 상담을 하고 참석자에게 클라우드 네이티브 기본 개념, 자체 전산센터와 민간 클라우드 간 하이브리드 클라우드 구성 가이드, 망분리 보안 구성 팁 등 심층적이고 실질적인 노하우를 제공했다.◆ PC 게임 ‘영웅 모집’ 카드와 유물 등 콘텐츠 업데이트영웅모집네오위즈(공동대표 김승철, 배태근)는 PC 게임 ‘영웅모집(Heroes Wanted)’에 새로운 카드와 유물 등 콘텐츠 업데이트를 진행했다고 25일 밝혔다.이번에 새롭게 추가된 카드는 ‘투석병’과 ‘마법사들의 왕’, ‘창술가’ 등 3종이다. 투석병은 적에게 강력한 데미지를 주는 스킬을 가지고 있다.마법사들의 왕은 광역 능력을 가진 카드들의 공격력을 50% 상승시킨다. 창술가는 받은 피격 시 반격하는 스킬을 보유하고 있다.‘연고’, ‘비옷’, ‘불타는 혈액’, ‘뒤틀린 가지’ 등 새로운 ‘유물’이 13종 추가됐다.유물은 게임 진행 중 체력 회복, 카드 변경, 방어력 증가 등 게임 플레이에 유리하게 활용할 수 있는 시스템이다.시작 덱과 유물 등 이용자들이 자유롭게 조정할 수 있는 커스터마이징 요소도 공개됐다.‘영웅모집’은 덱 빌딩 로그라이크 장르의 스팀 게임으로 로그라이크에 보드 게임의 시스템 중 하나인 ‘덱 빌딩(Deck Building)’을 추가해 색다른 재미를 선사한다.평범한 마을 소년이었던 ‘루카’가 자신에게 주어진 영혼석을 마왕으로부터 지키기 위해 다양한 영웅들을 만나 함께 적에게 대항하는 이야기를 담았다.지난해 11월 스팀에 얼리 엑세스 출시됐으며 올해 글로벌 시장에 선보일 예정이다.◆ ‘R2M’ 던전 콘텐츠 확장·성장효과 업데이트R2M웹젠(대표 김태영)은 모바일 MMORPG ‘R2M’에 던전 콘텐츠 확장과 캐릭터의 성장 효과를 업데이트하고 기념 이벤트를 선보인다.필드 던전인 ‘이계 왕의 무덤’ 3층과 4층이 열린다.‘R2M’ 내에서 ‘이계’ 모드의 던전은 캐릭터 90레벨 이상이 입장 가능하며, 기존의 필드 던전보다 난이도가 높은 만큼 드롭 아이템이 차별화된다.지난 10월 2층 오픈에 이어 상위 두 층이 새로 열리면서 ‘퀘스트 스크롤’과 ‘이계의 오염된 마석’ 아이템을 활용한 영구 도감이 추가된다.이계 왕의 무덤 4층에서는 ‘이계 벨제뷔트 보스’가 출현하고 이를 처치 시 높은 가치의 ‘장인의 초월 무기/방어구/장신구 제작 비급서 조각’과 다양한 ‘전설 스킬북 아이템’을 드롭한다.변신과 서번트의 성장 효과도 업데이트한다. 캐릭터의 공격력 능력치를 상승시키는 ‘바알베크의 변신 휘장’과 방어력 능력치를 상승시키는 ‘메테오스의 서번트 휘장’이 추가된다.웹젠은 이번 업데이트에서 이용자 편의를 위한 기능 및 설정도 개선한다.완료한 이벤트 숨기기 기능이 추가되고, 상자와 일부 유물 버프 스킬에 대해 자동 사용 설정이 가능해진다.이외에도 ‘스페셜 던전’을 기존 3층에서 4층으로 확장하고 영웅 서번트 ‘아이언’과 희귀 서번트 ‘펭펭’을 추가한다.한편 웹젠은 이번 업데이트를 기념해 내달 8일까지 계정당 1회 참여 가능한 두 가지 인게임 이벤트를 마련했다.",IT/과학,매일경제
갤럭시S24 개통 시작…공시지원금 최대 '24만원',"전작과 유사한 수준…전 요금제 25% 약정할인이 유리SK텔레콤 KT LG유플러스 이동통신 3사가 첫 갤럭시 인공지능(AI)폰 갤럭시S24 시리즈에 최대 24만원의 지원금을 공시했다. 전작 갤럭시S23 시리즈와 유사한 수준으로, 지원금보다 선택약정할인을 받는 게 유리하다.26일 통신 업계에 따르면, 3사 중 갤럭시S24 시리즈 지원금은 KT가 24만원으로 가장 높다.KT는 5G주니어 슬림 요금제 기준 5만원, 초이스 프리미엄 이용자의 경우 24만원을 지원한다. 유통망 추가지원금(최대 15%)을 더하면, 최대 27만6천원을 지원금으로 받을 수 있다.갤럭시S24 시리즈.LG유플러스는 5만2천~23만원을, SK텔레콤은 10만~20만원을 각각 책정했다.SK텔레콤의 5GX 플래티넘(월 12만5천원) 이용자는 20만원을 지원받을 수 있다. SK텔레콤은 3사 중 최대 지원금은 가장 낮지만, 최저 요금제 이용자가 받는 지원금이 KT, LG유플러스 대비 많다.갤럭시S24에 최대 지원금 기준으로 2년 약정 시 월별 단말 할인액은 1만원 수준이다.즉, 3사를 통한 갤럭시S24 구매자는 공시지원금을 통한 단말할인보다 25% 약정할인이 모든 요금제에서 유리한 구조다.",IT/과학,지디넷코리아
1회 충전으로 1000㎞…차세대 전기차 배터리 개발,"포스텍 연구진, 전자빔 활용해 일체형 실리콘-젤 전해질 시스템 개발박수진 포스텍 화학과 교수 연구진이 젤(gel) 형태의 고분자 전해질을 사용해 저렴하면서도 안정적인 마이크로 실리콘 기반의 차세대 고에너지 밀도를 가진 리튬이온 배터리 시스템을 개발했다. 사진은 전자빔 조사 공정을 통한 마이크로 실리콘과 젤 전해질 간 공유 결합 형성 과정./포스텍        국내 연구진이 700㎞에 불과한 전기차의 최대 주행거리를 1000㎞까지 끌어올리는 데 도움을 줄 수 있는 새로운 배터리 기술을 개발했다.포스텍은 박수진 화학과 교수 연구진이 젤(gel) 형태의 고분자 전해질을 사용해 저렴하면서도 안정적인 마이크로 실리콘 기반의 차세대 고에너지 밀도를 가진 리튬이온 배터리 시스템을 개발했다고 26일 밝혔다.효율적인 전기 생산을 위한 배터리 기술은 인공지능(AI)과 헬스케어와 같은 최첨단 과학기술의 핵심이다. 특히 배터리 기술이 현재 가장 많이 활용되는 분야는 전기차다. 전문가들은 1회 충전으로 1000㎞를 달리는 전기차를 위해 배터리 개발에 앞장서고 있다. 이를 위해 전기차에 사용되는 리튬이온 배터리 음극재로 저장 용량이 큰 실리콘을 활용하려는 연구가 활발하게 진행되고 있지만, 아직 상용화에 어려움이 많다.실리콘 음극재는 충·방전 시 부피가 3배 이상 팽창하고 수축하기 때문에 배터리 효율이 크게 떨어진다. 이에 값비싼 나노(nano, 10억분의 1m) 실리콘을 활용하면 문제를 일부 해결할 수 있지만, 제조 공정이 매우 복잡하고 까다로우며 천문학적인 비용이 필요하다. 반면 마이크로(micro, 100만분의 1m) 실리콘의 경우 가격과 에너지 밀도 측면에서 실용성은 비교적 높지만, 배터리 작동 중에 발생하는 부피 팽창 문제가 더욱 극심하게 나타나 음극재로 사용하기에 한계가 있었다.연구진은 경제적이면서도 안정적인 실리콘 기반 배터리 시스템을 개발하기 위해 젤 형태의 전해질을 사용했다. 리튬이온 배터리 내 전해질은 이온이 양극과 음극을 오고 갈 수 있는 중요한 요소다. 젤 전해질은 액체 형태의 일반적인 전해질과 달리 고체나 젤 상태로 존재하는데, 탄성이 있는 고분자 구조를 가져 액체 전해질에 비해 안정성이 높다.연구진은 전자빔을 활용해 마이크로 실리콘 입자와 젤 전해질 간 공유 결합을 형성했다. 이 공유 결합은 리튬이온 배터리 구동 중 부피 팽창으로 인한 내부 응력을 분산시켜 마이크로 실리콘 부피 변화를 완화해 구조적 안정성을 높였다.이를 적용한 결과, 기존 나노 실리콘 음극재에 비해 100배 큰 5㎛ 마이크로 실리콘 입자를 사용해도 안정적인 전지 구동력을 보였다. 연구진의 실리콘-젤 전해질 시스템은 액체 전해질을 사용한 기존 전지와 유사한 이온 전도도를 보였으며, 에너지 밀도는 약 40% 향상됐다. 연구진의 시스템은 현재 바로 적용할 수 있는 간단한 공정이라는 점에서도 큰 의의가 있다.연구를 이끈 박수진 교수는 “마이크로 실리콘 음극재를 사용했음에도 불구하고 구조적 안정성을 크게 증진시켰다”며 “이번 연구를 통해 실용적인 고에너지 밀도 리튬이온 배터리 시스템에 한 발 더 다가섰다”고 전했다.이번 연구는 국제 학술지 ‘어드밴스드 사이언스(Advanced Science)’에 이달 17일 온라인 게재됐다.참고 자료Advanced Science(2024), DOI: http://doi.org/10.1002/advs.202305298",IT/과학,조선비즈
"네이버 ‘프리즘 라이브 스튜디오’ 모바일 앱, B2B 시장 확장","“B2B 고객사 맞춤형 개발 가능”네이버는 자사의 모바일 라이브 스트리밍 앱 ‘프리즘 라이브 스튜디오’ 의 B2B(기업간거래) 상품을 네이버 클라우드 플랫폼에서 출시했다고 26일 밝혔다.2019년 3월 출시된 ‘프리즘 라이브 스튜디오’는 PC와 모바일 환경에서 동영상 라이브 스트리밍 송출과 동영상 편집 기능을 제공하는 멀티 플랫폼이다.특히 이 서비스는 사용자의 기기에서 이뤄지는 카메라 라이브나 게이밍 라이브 스트리밍에 활용되는 스크린 캐스트, 가상 아바타를 앞세워 진행하는 캐릭터 라이브 스트리밍을 모두 지원한다. PC 환경과 모바일 앱 간 자유로운 연결을 지원하는 ‘리모컨 기능’과 각종 이펙트 등 스트리밍 관련 기능도 꾸준히 고도화해 왔다고 회사는 설명했다.이 서비스는 일반 이용자들도 전문가처럼 편리하게 라이브 스트리밍을 송출할 수 있으며, 네이버 쇼핑라이브, 치지직, 밴드, 네이버TV를 비롯해 유튜브나 페이스북 등 글로벌 라이브 플랫폼에서의 스트리밍 송출도 지원한다.네이버 측은 “전세계 200여 개 국에서 ‘프리즘 라이브 스튜디오’를 사용하고 있으며 해외 유저 비중이 90%에 달해 글로벌에서도 우수한 기술력을 인정받고 있다”고 자평했다.앱 데이터 분석 플랫폼 Data.ai 데이터에 따르면 1월 기준 이 서비스는 구글플레이 및 앱스토어 모바일 스트리밍 앱 다운로드 순위 1위를 기록하고 있다.구체적으로 이 서비스는 기존 모바일 앱에서 제공하던 모든 기능이 자동으로 연동되고 기업 고객이 운영하는 스트리밍 서비스나 설루션에 커스터마이징(맞춤 제작)한 통합 설루션 개발도 가능하다. 이를 통해 인프라나 개발 인력이 부족한 기업들도 손쉽게 라이브 스트리밍 서비스를 구축할 수 있다고 네이버는 강조했다.아울러 네이버는 프리즘 라이브 스튜디오의 B2B 상품 출시를 바탕으로 네이버 클라우드 플랫폼 내 미디어 라이브 기능 구축에 필요한 전 구간별 기술 설루션 라인업이 완성됐다고 전했다.송출 영역을 담당하는 ‘프리즘 라이브 스튜디오’, 백엔드 클라우드 기술을 제공하는 ‘라이브 스테이션’, 미디어 재생 영역 설루션을 제공하는 ‘비디오 플레이어 인핸스먼트(Video Player Enhancement)’가 대표적이다. 기업 고객들은 각 사의 비즈니스에 맞게 제품을 구성할 수 있다.송지철 네이버 프리즘 스튜디오 개발 리더는 “프리즘 라이브 스튜디오는 출시 이후 꾸준한 기능 개선 및 기술 고도화로 글로벌 라이브 스트리밍 시장에서 꼭 필요한 앱으로 많은 이용자들의 선택을 받고 있다”며 “B2B 상품 출시를 바탕으로 기업용 개발에 나서 네이버의 우수한 기술력을 더욱 확대해 나가겠다”고 말했다.",IT/과학,매일경제
"NASA 화성탐사 헬리콥터, 72번의 비행 끝에 임무 종료","NASA의 화성 탐사 헬리콥터 인저뉴이티가 지난 2021년 6월 화성에 착륙한 모습. /NASA 제공, 연합뉴스										미 항공우주국(NASA)의 화성 헬리콥터 ‘인저뉴이티’가 25일(현지 시각) 공식적으로 임무 종료를 알렸다.빌 넬슨 NASA 국장은 이날 공식 X(옛 트위터) 계정을 통해 “‘할 수 있을 것 같다’는 말을 반복하는 듯 계속해서 임무에 성공했던 인저뉴이티가 이저 마지막 비행을 마쳤다는 소식을 전하는 것이 달콤씁쓸하다”며 이 같은 소식을 발표했다. NASA 측은 이날 기자회견을 열고 “지난주 인저뉴이티의 비행 이후 최소 1개의 로터가 파손됐다”며 임무 종료 이유를 밝혔다.화성 탐사용 초소형 무인 헬기 '인저뉴이티'(오른쪽)는 탐사 로봇 '퍼서비어런스'(왼쪽)가 바퀴로 오르내릴 수 없는 지역을 비행하며 관측하는 임무를 하고 있다. 사진은 나사가 실제 임무를 묘사하기 위해 만든 것이다./미 항공우주국(NASA)										인저뉴이티는 지난 2021년 2월 화성에 도착했다. 당초 한 달간 5차례 비행을 목표로만들어졌지만 최근까지 총 72번의 비행을 수행했다. 지난 18일 72번째 비행 중 통신이 끊겼다가 20일 다시 교신에 성공하며 희망을 주기도 했다. 그러나 이 비행 중 날개 부분이 파손 된 것으로 알려졌다.NASA의 화성 탐사 헬리콥터 인저뉴이티가 첫 비행에서 찍은 자체 그림자와 화성 분화구의 모습./NASA, 연합뉴스										인저뉴이티는 수십억년 전 물이 고여있는 화성의 분화구 등을 탐사하며 고대 퇴적암에 대한 연구 자료 등을 전송하는 등 화성에서 생명체와 물의 흔적을 찾는 임무를 수행해왔다.시어도어 자네토스 인저뉴이티 프로젝트 책임자는 이날 기자회견에서 “인저뉴이티가 보내 온 사진의 그림자에서 파손의 흔적을 발견했다”며 “사진 확인 직후에는 절망에 빠졌지만 그간 우리가 해온 일들이 얼마나 대단했는지 자부심이 들었다”고 했다.  NASA는 앞으로 인저뉴이티의 시스템을 최종 점검하고 자료를 전송한 후, 어떤 문제로 인저뉴이티의 날개에 손상이 갔는지 확인하는 작업을 계속할 예정이다. 또 다른 헬리콥터를 보내 화성 탐사 활동을 지속할 계획이다.",IT/과학,조선일보
"애플, 유럽 앱스토어 개편안 내놓은 뒤…""최악 될 것""","이 기사는 국내 최대 해외 투자정보 플랫폼 한경 글로벌마켓에 게재된 기사입니다.사진=AP애플이 유럽 디지털시장법(DMA) 규제에 따라 앱스토어와 인앱결제 시스템을 개방키로 했다. 애플 임원은 ""아이폰 유저들에게 최악의 사용자 경험을 안길 것""이라고 경고했다.애플은 25일(현지시간) ""오는 3월부터 유럽에서 아이폰 이용자는 애플의 전속 앱스토어가 아닌 다른 플랫폼에서 앱을 다운받을 수 있고, 앱 개발자는 아이폰의 인앱결제가 아닌 다른 결제 수단을 제공할 수 있게 된다""며 대대적인 개편안을 발표했다. 이번 조치는 3월부터 유럽연합(EU)에서 빅테크(대형기술 기업)의 폐쇄적인 플랫폼을 전면 개방하도록 한 DMA가 시행되는 데 따른 것이다. 3월 iOS 소프트웨어 업데이트를 통해 적용될 예정이다.애플은 그동안 개인정보보호 등을 이유로 애플스토어에서만 앱을 다운로드 받을 수 있게 허용했던 방침을 폐기했다. 유럽의 아이폰 이용자들은 앞으로 애플스토어가 아닌 다른 앱스토어에서도 앱을 다운받을 수 있게 된다. 다만 애플이 앱 다운을 검증(승인)할 수 있는 권한을 부여할 방침이다. 또한 애플의 결제 시스템(인앱결제)이 아니라 대체 결제 시스템도 제공된다. 앱 개발자들은 가격을 낮추면서 더 많은 수익을 낼 수 있게 됐다. 대체 결제 시스템을 통한 거래는 기본적으로 수수료가 부과되지 않는다. 애플은 인앱결제를 통한 거래 수수료는 기존 15∼30%에서 10∼17%로 낮추기로 했다. 다만 또 다른 명목의 추가 결제 수수료 시스템을 도입했다. 애플의 결제 시스템 이용시 3%의 결제 처리 수수료를 부과하고, 100만번 이상 설치된 앱에 대해서는 설치 건당 0.50유로(725원)의 '핵심 기술 수수료'를 부과하기로 했다.월스트리트저널(WSJ) 등은 ""유럽의 DMA에도 불구하고 '애플 생태계' 바깥의 소프트웨어를 상대로 여전히 강한 통제력을 행사하겠다는 의미""라며 ""DMA 시행으로 높은 수수료 없이 자유롭게 앱을 출시할 수 있을 것으로 기대했던 앱 개발자들에 반발을 불러일으킬 수 있다""고 전망했다. 애플은 이와 관련해 ""유럽 내 99% 이상의 개발자들은 애플에 내는 수수료가 줄어들고, 앱 설치 수수료를 내야 하는 개발자는 전체 1%도 되지 않을 것""이라고 설명했다.애플 앱스토어를 총괄하는 필 쉴러는 파이낸셜타임스(FT)에 ""애플의 폐쇄적인 소프트웨어 생태계를 깨려는 당국의 규제로 인해 유럽 아이폰 유저들은 사용자 경험을 다른 국가의 유저들만큼 누리지 못하게 될 것""이라며 ""개방된 마켓플레이스에서는 애플이 앱 관련 각종 사기를 식별하고 대응하는 데 더 느려질 수밖에 없다""고 비판했다. 그는 ""이번 조치는 우리의 차선책""이라며 ""애플은 항상 전 세계 어디에서나 가장 높은 기준을 적용하기를 원하지만, 현지 시장의 법적 요건을 충족해야 하는 어려움도 있다""고 말했다.",IT/과학,한국경제
